,url,content
0,https://www.reddit.com/r/secretlab/comments/19ej3z8/faq_secretlab_titan_evo_lite/,"The Secretlab TITAN Evo Lite was designed to bring the award-winning TITAN Evo experience to as many people as possible. We could have made a much cheaper chair with cheaper materials and fewer features, compromising the durability, performance, and overall experience."
1,https://www.pcgamer.com/hardware/shhh-dont-tell-everyone-but-the-secretlab-titan-evo-lite-is-the-gaming-chair-i-would-actually-buy-this-weekend/,"Secretlab Titan Evo Lite | Leatherette or softweave fabric | $459 $419 at Secretlab (save $40) Our favorite gaming chair does not come cheap, with the prices having risen consistently since the"
2,https://www.pcgamer.com/secretlab-titan-evo-2022-review/,The Titan Evo 2022 is Secretlab firing on all cylinders. It's a wonderfully comfortable chair for long periods of working or gaming and clever new features such as a magnetic head rest put it a
3,https://www.reddit.com/r/secretlab/comments/1b8q2zx/secret_lab_titan_evo_review/,"Secret Lab Titan Evo Chair Honest Review ... Secret Lab Chair Titan Evo Gaming Setup comment. r/secretlab. r/secretlab. A subreddit for all things Secretlab — we engineer award-winning performance gaming chairs for work and play. Show off your awesome setups, discuss the Secretlab TITAN Evo or Secretlab Classics and Secretlab MAGNUS, or catch"
4,https://www.tomshardware.com/reviews/secretlab-titan-evo-2022-review-superior-gaming-chair,"The Secretlab Titan Evo 2022 is a firm gaming chair that supports your back in all the right ways, including a lumbar support system you can place at just the right height and firmness."
5,https://www.reddit.com/r/secretlab/comments/14axd1w/my_honest_review_of_secretlab_titan_after_55/,"A subreddit for all things Secretlab — we engineer award-winning performance gaming chairs for work and play. Show off your awesome setups, discuss the Secretlab TITAN Evo or Secretlab Classics and Secretlab MAGNUS, or catch up with fellow Secretlab (or soon-to-be!) owners."
6,https://www.reddit.com/r/GamingChairAdvice/comments/185wq4h/best_gaming_chair_reddits_verdict_top_5_picks/,"Titan Evo - Best Gaming Chair. Current Price: $609 The Titan Evo, a standout in the realm of good gaming chairs Reddit users rave about, merges ergonomic design with a sleek aesthetic. ... The Titan Evo, epitomizing Secretlab's dedication to innovation and quality, is perfect for gamers who want style, comfort, and adaptability."
7,https://www.reddit.com/r/secretlab/comments/mvywm0/honest_secretlabs_review_read_before_you_buy/,"A subreddit for all things Secretlab — we engineer award-winning performance gaming chairs for work and play. Show off your awesome setups, discuss the Secretlab TITAN Evo or Secretlab Classics and Secretlab MAGNUS, or catch up with fellow Secretlab (or soon-to-be!) owners."
8,https://www.reddit.com/r/buildapc/comments/10rd4gh/are_secretlab_chairs_worth_it_over_a_good_office/,Super bad for gaming. Convenient to clean. But uncomfortable. My mesh is ALWAYS a good temperature. The fact that most gaming chairs are leather gives them an especially bad reputation. Leather sucks to sit in for a long time (HOT HOT HOT) Most gaming chairs get a bad rap (deserved) but the 2022 Titan Evo doesn't deserve it.
9,https://www.reddit.com/r/secretlab/comments/148ubkv/titan_evo_review_after_10_months/,"A subreddit for all things Secretlab — we engineer award-winning performance gaming chairs for work and play. Show off your awesome setups, discuss the Secretlab TITAN Evo or Secretlab Classics and Secretlab MAGNUS, or catch up with fellow Secretlab (or soon-to-be!) owners."
10,https://www.reddit.com/r/secretlab/comments/13pkmxv/honest_review_2022_titan_evo/,"Show off your awesome setups, discuss the Secretlab TITAN Evo or Secretlab Classics and Secretlab MAGNUS, or catch up with fellow Secretlab (or soon-to-be!) owners. ... ADMIN MOD Honest review: 2022 Titan EVO General Honestly, the chair has some really good things and some really bad things. ... I did sit in a friends off brand gaming chair the"
11,https://www.tomshardware.com/peripherals/gaming-chairs-desks/fractal-refine-review,"Secretlab's Titan Evo gaming chair discounted for Presidents' Day Razer's PC-adjacent CES lineup includes a monitor stand, lights, and a chair with integrated heating and cooling Fractal Refine"
12,https://www.pcgamer.com/,"PC Gamer is your source for exclusive reviews, demos, updates and news on all your favorite PC gaming franchises."
13,https://www.reddit.com/r/gaming/,"r/gaming: The Number One Gaming forum on the Internet. Skip to main content. Open menu Open navigation Go to Reddit Home. r/gaming A chip A close button. Get app ... I reached what people are calling Layer 2 last night and I literally sat in my chair and said, ""holy s%#^."" I now had knowledge and tools at my disposal that let me explore the"
14,https://www.reddit.com/r/reddit/wiki/index/,"Reddit - The heart of the internet Open menu Open navigation Go to Reddit Home r/reddit A chip A close button r/reddit r/reddit Wiki Open menu*   View page history We are experimenting with translating some r/reddit posts into different languages and linking them here. Making it easier to share your favorite Reddit content Reddit Rules Privacy Policy User Agreement Reddit, Inc. Action Movies & Series Animated Movies & Series Comedy Movies & Series Crime, Mystery, & Thriller Movies & Series Documentary Movies & Series Drama Movies & Series Fantasy Movies & Series Horror Movies & Series Movie News & Discussion Reality TV Romance Movies & Series Sci-Fi Movies & Series Superhero Movies & Series*   TV News & Discussion Communities Best of Reddit Topics"
15,https://www.reddit.com/r/OfficeChairs/comments/17pahd3/my_ultimate_chair_buying_guide_2023/,"Reddit - Dive into anything Open menu Open navigation  Go to Reddit Home r/OfficeChairs A chip A close button r/OfficeChairs r/OfficeChairs  My Ultimate Chair Buying Guide 2023 I just finished my ultimate chair buying guide for 2023! Reddit Reddit Reddit Action Movies & Series Animated Movies & Series Comedy Movies & Series Crime, Mystery, & Thriller Movies & Series Documentary Movies & Series Drama Movies & Series Fantasy Movies & Series Horror Movies & Series Movie News & Discussion Reality TV Romance Movies & Series Sci-Fi Movies & Series Superhero Movies & Series*   TV News & Discussion Communities Best of Reddit Topics"
16,https://www.reddit.com/r/iBUYPOWER/comments/ouoglc/i_bought_a_pc_from_ibuypower_an_honest_review/,"Welcome to r/gaminglaptops, the hub for gaming laptop enthusiasts. Discover discussions, news, reviews, and advice on finding the perfect gaming laptop. Join our passionate community to stay informed and connected with the latest trends and technologies in the gaming laptop world."
17,https://www.reddit.com/r/magicTCG/comments/185vy8o/this_websites_prices_look_too_good_to_be_true/,"Reddit - The heart of the internet Open menu Open navigation Go to Reddit Home This website’s prices look too good to be true. This is a scam, right? This website popped up as an ad on my instagram feed. New to Reddit?Create your account and connect with a world of communities. Top Posts Reddit reReddit: Top posts of November 28, 2023 * * * Reddit reReddit: Top posts of November 2023 * * * Reddit reReddit: Top posts of 2023 * * * Reddit Rules Privacy Policy User Agreement Reddit, Inc. Communities Best of Reddit Topics Cricket_Official • Promoted"
18,https://www.tomshardware.com/,### Nvidia's new tech reduces VRAM usage by up to 96% in beta demo Aaron Klotz published 8 February 25 Nvidia's upcoming RTX Neural Texture Compression has been tested on an RTX 4090. It shows an impressive 96% reduction in texture memory size compared to outgoing texture compression techniques. ### Nvidia is investigating RTX 5090 and RTX 5080 instability issues Roshan Ashraf Shaikh published 8 February 25 Some stopgap solutions exist while we wait for Nvidia's official fix. ### Zotac is selling RTX 50-series GPUs directly to customers to thwart scalpers Jowi Morales published 8 February 25 Zotac USA implements a priority access system to sell RTX 5080 and RTX 5090 GPUs directly to its fans on its Discord server.
19,https://www.tomshardware.com/3d-printing/sovol-sv06-ace-review,"Sovol's SV06 ACE is a super affordable, speedy bedslinger in the style of Prusa's i3 machines. It has excellent quality at speed thanks to Klipper, and comes with a surprising number of perks"
20,https://www.reddit.com/r/furniture/comments/1971byf/any_real_person_try_anabei_couches/,Their social media and google search advertising is crazy aggressive. And they have been having their sale since November! Still waiting for the reviews to come in before making any purchase since I like the sixpenny dupe but don't want to pay the full $$$
21,https://www.reddit.com/r/GamingLaptops/comments/o0s2xz/is_antonline_a_reliable_trusted_retailer/,"Welcome to r/gaminglaptops, the hub for gaming laptop enthusiasts. Discover discussions, news, reviews, and advice on finding the perfect gaming laptop. ... and it's in stock, ready for delivery and said that it'd take 2 weeks maximum to arrive. Online review have said they're a trusted retailer, but, at the same time, others have said to be"
22,https://www.reddit.com/r/CYBERPOWERPC/comments/wyu078/cpgeneral_solved_finally_found_out_how_to_control/,CYBERPOWERPC is a builder of custom gaming PCs and gaming notebooks with an extensive range of customization options for your needs. We look forward to answering all questions regarding PC builds to help you craft your perfect gaming machine. ... right now the front fan rgbs are unplugged and only the cpu cooler and rear fan are lite. But they
23,https://www.reddit.com/r/GamingLeaksAndRumours/,"Insider Gaming: it was said that the premise of the campaign is for the player to rescue their entire family within a specific time frame. Currently, the current in-game timer stands at 72 hours, or 24 hours in real-time, but the timer can be paused when the player enters one of their safehouses, it was said."
24,https://www.reddit.com/r/Windows11/comments/123ut28/pros_and_cons_of_tiny11/,"You don't necessarily need a PC to be a member of the PCMR. You just have to love PCs. It's not about the hardware in your rig, but the software in your heart! Join us in celebrating and promoting tech, knowledge, and the best gaming, study, and work platform there exists. The Personal Computer."
25,https://www.reddit.com/r/loveandlighttv/,"r/loveandlighttv: see when your pushing, its not the pushing that feels good its the wetness."
26,https://www.reddit.com/r/techsupport/comments/69jk68/do_you_suggest_using_revo_uninstaller/,"Having a computer for years and installing / uninstalling programs using the control panel, don't you end up cluttering your pc? Don't you need something like Revo in this case?"
27,https://www.reddit.com/r/browsers/comments/1bvc13a/browser_recommendation_megathread_april_2024/,"Reddit - Dive into anything Open menu Open navigation  Go to Reddit Home Go to browsers r/browsers r/browsers Topics on web browsers. Browser Recommendation Megathread - April 2024 and ""What browser has feature X?"" posts that are making things a mess here and making it annoying for subscribers to sort through and read other types of posts. Previous Recommendation Megathread: https://www.reddit.com/r/browsers/comments/1b63sfa/browser_recommendation_megathread_march_2024/ Reddit Reddit Reddit Reddit Rules Privacy Policy User Agreement Reddit, Inc. Action Movies & Series Animated Movies & Series Comedy Movies & Series Crime, Mystery, & Thriller Movies & Series Documentary Movies & Series Drama Movies & Series Fantasy Movies & Series Horror Movies & Series Movie News & Discussion Reality TV Romance Movies & Series Sci-Fi Movies & Series Superhero Movies & Series*   TV News & Discussion Communities Best of Reddit Topics"
28,https://www.reddit.com/r/Cyraxx/,"TIL Michael Berryman, known for his iconic roles in horror movies (The Hill Have Eyes), has a very unique physical appearance due to hypohidrotic ectodermal dysplasia, a rare condition characterized by the absence of sweat glands, hair, and fingernails."
29,https://www.reddit.com/r/nvidia/comments/cta4hr/low_latency_mode_optimal_setting/,"A place for everything NVIDIA, come talk about news, drivers, rumors, GPUs, the industry, show-off your build and more. This Subreddit is community run and does not represent NVIDIA in any capacity unless specified."
30,https://www.reddit.com/r/Scams/comments/pgaiie/bought_a_jersey_from_this_website_am_i_being/,"Looks pretty sketchy to me. The 'About Us' is meaningless 'happy words' that actually tell you nothing about the company. The bottom of the page that appears regularly says 'Follow Steelers Pro Shop' and has social media links that merely go to the home page for each service.. Although if this is a scam site, I'm surprised they've hung around for 4 years (based on Whois and Wayback Machine)."
31,https://www.reddit.com/r/MechanicalKeyboards/comments/19de2bx/list_of_hall_effect_keyboards_2024/,Perfect in-between of a enthusiast/custom keyboard + gaming keyboard. Keychron Q1 HE - Preorder - 75% - $219.00 - Starts shipping April 2024 | Three-mode Connection | QMK & VIA. Seems to support 3 different Gateron Magnetic switches so far. Perfect in-between of a enthusiast/custom keyboard + gaming keyboard.
32,https://www.reddit.com/r/gigabyte/comments/12r2t7u/what_if_any_software_should_i_download_from/,"/r/StableDiffusion is back open after the protest of Reddit killing open API access, which will bankrupt app developers, hamper moderation, and exclude blind users from the site."
33,https://www.reddit.com/r/gamehacks/comments/6rjylo/safe_website_to_download_game_hacks/,What's the best websites to download safe (non-virus) game hacks? I'm currently using unknowncheats.me but certain games are lacking hacks
34,https://www.reddit.com/r/pcgaming/comments/9e9ddl/is_cheat_engine_safe_to_install/,"Some games such as League of Legends scans to see if CE is installed, and will trigger their anticheat just by having it installed. I recently dealt with this, and the Riot employee who was dealing with my ticket said that CE had to be running, yet I rebooted and everything, even going as far as killing every non-critical process."
35,https://www.reddit.com/r/ZephyrusG15/comments/11te6b8/my_complete_detailed_optimization_guide_for_asus/,"Disabling CPU turbo boost while gaming (especially CPU bound competitive titles) will result in huge FPS losss. If youre plugged into the charger, but doing light tasks like browsing the web etc. I still recommend disabling CPU turbo boost, since it also helps with temperatures and fan noise. In Eco+Silent mode, you should be getting around 45"
36,https://www.reddit.com/r/CrackWatch/,Name Release Homeworld 3 2024-05-13 F1 24 2024-05-31 Monster Hunter Stories A: 2024-06-14
37,https://www.reddit.com/r/antivirus/comments/tvdvou/how_reliable_is_virus_total/,"Reddit - Dive into anything Open menu Open navigation  Go to Reddit Home Go to antivirus I'm almost certain that false negatives can happen but now I'm wondering how common it is or how reliable VT is in general. New to Reddit?Create your account and connect with a world of communities. Top Posts Reddit Reddit Reddit Reddit Rules Privacy Policy User Agreement Reddit, Inc. Action Movies & Series Animated Movies & Series Comedy Movies & Series Crime, Mystery, & Thriller Movies & Series Documentary Movies & Series Drama Movies & Series Fantasy Movies & Series Horror Movies & Series Movie News & Discussion Reality TV Romance Movies & Series Sci-Fi Movies & Series Superhero Movies & Series*   TV News & Discussion Communities Best of Reddit Topics"
38,https://www.reddit.com/r/nvidia/comments/1bsdi5h/how_is_everyone_using_the_rtx_digital_vibrance/,"A place for everything NVIDIA, come talk about news, drivers, rumors, GPUs, the industry, show-off your build and more. This Subreddit is community run and does not represent NVIDIA in any capacity unless specified."
39,https://www.reddit.com/r/Piracy/comments/18eovgj/recommendations_for_free_online_movie_sites/,"Reddit - Dive into anything Open menu Open navigation  Go to Reddit Home Go to Piracy r/Piracy r/Piracy Recommendations for free online movie sites? So, I’m planning on hosting some movie nights with my online friends, but the site i usually use was taken down due to copyright :( do you have any recommendations for some sites I could use? Top Posts Reddit Reddit Reddit reReddit: Top posts of 2023 * * * Action Movies & Series Animated Movies & Series Comedy Movies & Series Crime, Mystery, & Thriller Movies & Series Documentary Movies & Series Drama Movies & Series Fantasy Movies & Series Horror Movies & Series Movie News & Discussion Reality TV Romance Movies & Series Sci-Fi Movies & Series Superhero Movies & Series*   TV News & Discussion Communities Best of Reddit Topics Reddit, Inc."
40,https://www.reddit.com/r/PiratedGames/comments/rx8mh5/are_fling_trainers_safe/,"Make sure to read the stickied megathread, as it might just answer your question!Also check out our videogame piracy guide and the list of Common Q&A part 1 and part 2.Or just read the whole Wiki.. I am a bot, and this action was performed automatically. Please contact the moderators of this subreddit if you have any questions or concerns."
41,https://www.reddit.com/r/MicrosoftRewards/comments/gkzzw9/tipstricks_for_a_friend/,That pretty much covers all the ways to get points. I would also tell him: Do not spend points on giveaways or Flip 'n Win or whatever. It's like playing the lottery.
42,https://www.reddit.com/r/overclocking/comments/lvgd68/where_do_i_go_to_download_testmem5_anta777_extreme/,"Cooler Master was founded 30 years ago with the mission of making the industry's best thermal solutions. With a little magic & a bit of thermal paste, we have transformed into that poggers gaming lifestyle tech brand with products even your Grandma would . From PC hardware to streaming equipment, custom MODs, you name it, we've mastered it."
43,https://www.reddit.com/r/InteractiveCYOA/,"This subreddit is for the sharing and finding of Interactive CYOA. CYOA Are something like character/scenario creators for role-playing, fantasy fulfillment, and story development. Interactive CYOA are CYOA where, when you select the choices, the choices are logged and typically marked in some way to show that it has been chosen, and also keeps track of your points."
44,https://www.reddit.com/r/timberwolves/wiki/index/,Subreddit Rules 1.6 - Updated: June 2019. Be civil. Personal insults/attacks are not tolerated here. Those who are overly negative or abusive will be warned/banned. Read reddiqette
45,https://www.reddit.com/r/ASUS/comments/pq23y3/do_i_need_armoury_crate/,"I just clean formatted my G14 2024 and it was much speedier not having all the factory bloatware. However, I couldn't get gsync working/enabled and even though I could select the GPU in game, the nvidia control panel still thinks the Integrated Graphics is connected and couldn't show me the settings for things like gsync."
46,https://www.reddit.com/r/Newegg/comments/vgp4bl/is_newegg_safe_to_buy_from/,"I bought SAMSUNG 870 EVO Series 2.5"" 1TB SATA III V-NAND on 2022, it can't boot anymore, chat with Newegg they said call Samsung, try to call Samsung 6 time in 3 days at the end they said Samsung policy is who sale the SSD who must give the service to replace or to repair, Samsung send me that policy paper and told me send that policy to Newegg and request the replacement."
47,https://www.reddit.com/r/uoguelph/comments/jer6el/how_to_cheat_using_the_respondus_lockdown_browser/,"EDIT: People have warned me that this post is ""aiding and abetting"" academic misconduct.As per Policy 1.6 Policy on Non-Academic Misconduct, ""The University of Guelph's core value is the pursuit of truth."". Lockdown Browser is a useless, invasive, and discriminative spyware - That's the truth. Everything listed here is the truth. People can stick their head in the sand or go after me, but"
48,https://www.reddit.com/r/LivestreamFail/,r/LivestreamFail: The place for all things livestreaming.
49,https://www.reddit.com/r/FitGirlRepack/comments/17jpqbp/beginners_guide/,"Heya, since there doesn't seem to be any guide at all, I thought I would make my own from my experience. Prerequisites: I recommend downloading the .torrent file from a TOR browser or through a VPN so as to keep you safe."
50,https://www.reddit.com/r/AssassinsCreedShadows/comments/1dd8e7u/what_are_your_thoughts_on_the_gameplay/,Looks fun. I just hope they polish up some of the animation transitions. For example the grappling hook into landing and some of the general movement animations look a bit janky because the acceleration of the character doesn't match when leaving one state and starting a preset animation.
51,https://www.reddit.com/r/TutorsHelpingTutors/comments/140xesz/whats_been_your_experience_with_superprof/,SUPER PROF is a SCAM SITE. Don't use them. I booked with someone named Ivy from Los Angeles who was an experienced math teacher who taught calc and precalc etc.
52,https://www.reddit.com/r/ChrisTitusTech/comments/17x6l3i/my_honest_opinion_on_chris_titus_techs_app/,"Adding to this: After I applied CTT Windows Utility on my newly setup PC with all the drivers installed, I noticed I no longer can change some settings because they were ""managed by an organization"" which is pretty annoying as I can't revert it back and forgot to set a restore point (it also doesn't automatically set a restore point before doing any tweaks)."
53,https://www.reddit.com/r/buildapc/comments/9lljy9/what_are_ideal_dangerous_temps_for_you_cpu_and_gpu/,"Hey, so I read the comments and to be honest I'm not a tech savvy, and since this was posted (thank goodness I read the comments, cause that table from excalibur scared me a bit, ngl) I have a question, for anyone who knows the answer, really:"
54,https://www.reddit.com/r/PUBATTLEGROUNDS/comments/170y8vv/erangels_secret_room_map_4k_made_by_pubg_partner/,Big's Playhouse - A Dominion Gaming Production upvote r/funkopop. r/funkopop. We're the largest Funko Community on reddit. Keep up to date with the newest releases or just browse other readers' hauls and collections. Members Online [Link in Image Caption] Funko Pop Animation Avatar The Last Airbender - Azula GITD Chase (Big Apple Exclusive) now
55,https://www.reddit.com/r/pokerogue/,"https://PokeRogue.net a Rogue-lite Pokemon battling browser-based game spanning all 9 generations. Note: this is a fan-made SubReddit, we are not the creators, owners, or affiliated with the game in any way aside from being avid fans. Keyboard controls: WASD = arrows/navigating menus Z = ""A""/Accept X= ""B""/Back/Decline Esc = Menu Wiki for info including which Pokemon are in which biomes and"
56,https://www.reddit.com/r/TTVreborn/comments/14icj6c/safe_alternatives_to_watch_free_movies/,"116 votes, 114 comments. true. Best illegal movie app I have found are Wodfix, must download castly app and a DLNA server such as fast cast55, or miracast, it's only 5.45 mo that's with tax for Tennessee works with Fire tv very well, tap on top right to cast to tv tap on the gray letters DLNA the u can watch."
57,https://www.reddit.com/r/ChatGPTJailbreak/new,"The sub devoted to jailbreaking LLMs. Share your jailbreaks (or attempts to jailbreak) ChatGPT, Gemini, Claude, and Copilot here. There are no dumb questions. If you're new, join and ask away."
58,https://www.reddit.com/r/FrugalFemaleFashion/comments/bxqjml/list_of_online_clothing_scam_companies/,"Reddit - Dive into anything LIST OF ONLINE CLOTHING SCAM COMPANIES As we search for frugal fashions, some online clothing companies remain poised to scam us. With most of them, an independent Google search of reviews will tell you everything you need to know (long wait period for clothes, won’t refund the clothes or if they do, you have to ship them to China, clothing delivered looks nothing like the picture) 15% of the time there are NO reviews which usually means the company is new/changed names from a different scam company. 5% of the time it’s ONLY glowing 5 ⭐️ reviews, which the company paid for. The Boho Boutique Reddit Reddit Reddit Communities Best of Reddit Topics Reddit, Inc."
59,https://www.reddit.com/r/TLAUNCHER/comments/zv3w3n/is_tl_legacy_safe/,"The current TL is, very likely, a spyware. The original one, that (I think) later was called TL Legacy, and later Legacy Launcher (due to legal problems with the ones who got it from them and are currently using it to spread spyware, because they wante to be the only ones with the name TLauncher/TL) isn't supposed to be."
60,https://www.reddit.com/r/FashionReps/,"r/FashionReps: Reddit's largest community for the discussion of replica fashion. Please press ""See Community Info."""
61,https://www.reddit.com/r/recruitinghell/comments/rwsk9z/list_of_recruiting_companies_to_stay_away_from/,"THIS. The other day I had some senior ""recruiter"" from Harvey Nash who tried to call me during work hours (WHILE the HR manager was right next to me might I add) AND sent me a job offer for a data entry position, all after looking at my LinkedIn profile which clearly indicated I was currently working as a staff accountant."
62,https://www.reddit.com/r/antivirus/comments/qo9vus/is_this_safe_and_false_positive_from_virustotal/,I made a little test. I made two little Delphi projects only with a main form but nothing else on it. I made one with VCL (Windows only) and one with FMX (cross platform) and uploaded both to virustotal.
