,url,content
63,https://www.reddit.com/r/nvidia/comments/fum7so/game_ready_driver_vs_studio_driver_whats_the/,"they are the same drivers, the difference is they are able to publish updates when they need to for software releases, since game drivers need updates with every big game release studio applications don't need as much. so when there are improvements to another soft ware they add it into the next studio driver release."
64,https://www.reddit.com/r/antivirus/comments/i9y6xc/are_trapmine_and_secureage_apex_trustworthy/,SecureAge Apex is one of the scanners used by VirusTotal. If it came from the legit website then its fine. TrapMine is also a legit tool but you have a bit of a steep learning curve ahead as its for endpoint threat management and mitigation on business networks.
65,https://www.reddit.com/r/MortalShell/comments/ic04wu/whats_this_tech_beta/,"Alright that makes sense, thanks for the reply dude! Yeah I only have Mortal Shell Tech beta, and I looked in the Epic Games store and the only Mortal Shell that shows is the one I bought so I'm kind of confused, I haven't even played a minute of the game yet trying to avoid exceeding the time limit that is there for refunds."
66,https://www.reddit.com/r/browsers/comments/190n3bf/whats_the_consensus_on_edge_now/,"What does this sub think of 2024 Edge? why do you care what a bunch of hypocrites think? the vast majority of this sub would run some obscure and outdated chromium/gecko fork because it's ""oPeN sOuRcE"" (2 thirds of them don't even know if-else loops) and then they proceed with logging into all of their google/microsoft accounts from their ""ultra private browser"" while saying that edge/chrome"
67,https://www.reddit.com/r/PhasmophobiaGame/comments/xkkogp/which_ghosts_are_the_fast_ghosts_in_phasmophobia/,"This is the subreddit for the Elden Ring gaming community. Elden Ring is an action RPG which takes place in the Lands Between, sometime after the Shattering of the titular Elden Ring. Players must explore and fight their way through the vast open-world to unite all the shards, restore the Elden Ring, and become Elden Lord."
68,https://www.reddit.com/r/selfhosted/comments/xw66pl/any_selfhosted_alternative_to_drawio_or_excalidraw/,"A place to share, discuss, discover, assist with, gain assistance for, and critique self-hosted alternatives to our favorite web apps, web services, and online tools."
69,https://www.reddit.com/r/TeamfightTactics/comments/qn07rh/i_stumbled_upon_sologesangs_comp_tier_list_that/,Here is link to sologesang's tier list… Topmains and everything they have to talk about. Matchup Discussion where mains of both champs can talk about how they feel the matchup works.
